,id,interest_name,interest_summary,created_at,last_modified
382,6298,Readers of Russian Content,People reading news from Russian media sources.,2017-05-03 10:00:02,2018-05-23 16:19:11
383,6299,Readers of Bengali Content,People reading news from Bengali media sources.,2017-05-03 10:00:02,2018-05-23 16:19:11
384,6300,Washington DC Trip Planners,"People researching attractions and accommodations in Washington DC. These consumers are more likely to spend money on flights, hotels, and local attractions.",2017-05-03 10:00:02,2017-12-07 12:35:47
385,6301,Chicago Trip Planners,"People researching attractions and accommodations in Chicago. These consumers are more likely to spend money on flights, hotels, and local attractions.",2017-05-03 10:00:02,2017-12-07 12:35:47
386,6302,Los Angeles Trip Planners,Consumers in-market for Los Angeles trips and vacations.,2017-05-03 10:00:02,2018-05-23 11:30:12
387,6303,Atlanta Trip Planners,"People researching attractions and accommodations in Atlanta. These consumers are more likely to spend money on flights, hotels, and local attractions.",2017-05-03 10:00:02,2017-12-07 12:35:47
388,6304,New York Trip Planners,Consumers in-market for New York City trips and vacations.,2017-05-03 10:00:02,2018-05-23 11:30:13
389,6305,Identity Theft Protection Researchers,People researching and comparing products and services for identity theft protection.,2017-05-03 10:00:02,2017-12-27 12:31:08
390,6306,Newly Recruited Military Personnel,Professionals reading industry news and researching products and services as newly recruited military personnel.,2017-05-03 17:22:58,2017-12-27 12:31:08
391,6308,Food Safety Decision Makers,Professionals reading industry news and researching products and services for food safety.,2017-05-04 11:02:49,2017-12-27 12:31:08
392,6314,Online Directory Searchers,Consumers using online directories.,2017-05-10 11:37:50,2018-05-23 11:30:13
393,6315,Boston Trip Planners,Consumers in-market for Boston trips and vacations.,2017-05-10 16:11:32,2018-05-23 11:30:12
394,6316,Philadelphia Trip Planners,"People researching attractions and accommodations in Philadelphia. These consumers are more likely to spend money on flights, hotels, and local attractions.",2017-05-10 16:13:56,2017-12-07 12:35:47
395,6317,Houston Trip Planners,Consumers in-market for Houston trips and vacations.,2017-05-10 16:13:56,2018-05-23 11:30:12
396,6318,Phoenix Trip Planners,"People researching attractions and accommodations in Phoenix. These consumers are more likely to spend money on flights, hotels, and local attractions.",2017-05-10 16:13:56,2017-12-07 12:35:47
397,6319,San Francisco Trip Planners,Consumers in-market for San Francisco trips and vacations.,2017-05-10 16:13:56,2018-05-23 11:30:13
398,6320,Miami Trip Planners,"People researching attractions and accommodations in Miami. These consumers are more likely to spend money on flights, hotels, and local attractions.",2017-05-10 16:13:56,2017-12-07 12:35:47
399,6321,Nashville Trip Planners,"People researching attractions and accommodations in Nashville. These consumers are more likely to spend money on flights, hotels, and local attractions.",2017-05-10 16:13:56,2017-12-07 12:35:47
400,6322,Seattle Trip Planners,Consumers in-market for Seattle trips and vacations.,2017-05-10 16:13:56,2018-05-23 11:30:13
401,6323,New Orleans Trip Planners,"People researching attractions and accommodations in New Orleans. These consumers are more likely to spend money on flights, hotels, and local attractions.",2017-05-10 16:13:56,2017-12-07 12:35:47
402,6324,Las Vegas Trip Planners,"People researching attractions and accommodations in Las Vegas. These consumers are more likely to spend money on flights, hotels, and local attractions.",2017-05-10 16:13:56,2017-12-07 12:35:47
403,6325,Orlando Trip Planners,"People researching attractions and accommodations in Orlando. These consumers are more likely to spend money on flights, hotels, and local attractions.",2017-05-10 16:13:56,2017-12-07 12:35:47
404,6328,Mattress Researchers,,2017-05-15 13:03:24,2017-05-15 13:03:24
405,6329,Mattress Shoppers,Consumers considering purchasing a mattress.,2017-05-15 13:04:55,2018-05-23 11:30:12
406,6330,Pet Store Goers,,2017-05-15 13:04:55,2017-05-15 13:04:55
407,6331,Price Conscious Grocery Shoppers,Consumers seeking good deals on groceries.,2017-05-15 13:04:55,2018-05-23 11:30:13
408,6332,Tire Researchers,,2017-05-15 13:04:55,2017-05-15 13:04:55
409,6333,Crafting Enthusiasts,People looking for crafting inspiration and purchasing equipment.,2017-05-15 13:04:55,2018-05-23 11:30:12
410,6334,Supermarket Shoppers,Consumers shopping for groceries at major supermarkets.,2017-05-15 13:04:55,2018-05-23 11:30:13
411,6335,Outdoors Enthusiasts,People reading outdoor activities news and destinations.,2017-05-15 13:04:55,2018-05-23 11:30:13
412,6336,Mid-Range Grocery Shoppers,Consumers shopping for groceries at mid-range grocery stores.,2017-05-15 13:04:55,2018-05-23 11:30:13
413,6337,Diner and Ice Cream Lovers,Consumers who often frequent diners and ice cream shops.,2017-05-15 13:04:55,2018-05-23 11:30:12
414,6339,Eyeglasses Wearers,,2017-05-15 13:04:55,2017-05-15 13:04:55
415,6340,Kitchen and Home Goods Shoppers,Consumers comparing or purchasing home and kitchen decor and furniture.,2017-05-15 13:04:55,2017-12-07 12:35:47
416,6341,Pharmacy Shoppers,Consumers researching and purchasing pharmaceuticals online.,2017-05-15 13:04:55,2018-05-23 11:30:13
417,6343,Patio Furniture Shoppers,Consumers comparing or purchasing patio furniture.,2017-05-15 13:04:55,2017-12-07 12:35:47
418,6344,Hair Care Shoppers,Consumers researching trends and purchasing hair and beauty products.,2017-05-15 13:04:55,2018-05-31 22:11:37
419,6345,Senior Caregivers,Professionals reading healthcare industry news focused on senior citizens.,2017-05-15 13:04:55,2018-05-23 11:30:13
420,6363,Readers of Caribbean Content,People reading news from Caribbean media sources.,2017-05-23 16:28:23,2018-05-23 16:19:11
421,6364,Pizza Lovers,,2017-05-23 18:19:22,2017-05-23 18:19:22
422,6365,Executive and C-Suite,People identified as holding executive positions as companies .,2017-05-23 18:19:22,2018-09-07 08:06:58
423,6366,Rideshare App Users,People that regularly use rideshare apps for travel,2017-05-23 18:19:22,2019-08-20 11:34:51
424,6367,Cable TV Shoppers,Consumers researching cable TV packages.,2017-05-23 18:19:22,2018-05-23 11:30:12
425,6378,Luggage Shoppers,Consumers in-market for new luggage.,2017-05-31 16:26:05,2018-05-23 11:30:12
426,6385,Motorcycle Purchasers,,2017-06-08 12:21:04,2017-06-08 12:21:04
427,6386,Powerboat Purchasers,,2017-06-08 12:21:04,2017-06-08 12:21:04
428,6387,Wireless Service Provider Researchers,,2017-06-08 12:21:04,2017-06-08 12:21:04
429,6389,Oil Change Customers,,2017-06-08 12:21:04,2017-06-08 12:21:04
430,6390,Pool and Spa Researchers,,2017-06-08 12:21:04,2018-09-07 08:07:11
431,6391,HVAC Service Researchers,,2017-06-08 12:21:04,2017-06-08 12:21:04
432,6393,Eye Health Researchers,People researching eye health and symptoms.,2017-06-08 12:21:04,2018-05-23 11:30:12
433,7425,Life Insurance Researchers,People researching and comparing life insurance policies. These consumers are more likely to spend money with insurance companies.,2017-06-15 17:44:51,2017-12-27 12:31:08
434,7453,Pilots,Professionals reading industry news and researching products and services for pilots.,2017-06-27 17:12:58,2017-12-27 12:31:08
435,7454,Farmers,Professionals reading industry news and researching products and services for farmers.,2017-06-27 17:12:58,2017-12-27 12:31:08
436,7461,Food Industry Professionals,Professionals reading industry news and researching products and services for food safety.,2017-06-28 13:17:51,2018-05-23 16:19:11
437,7464,Guitar Enthusiasts,People reading guitar news and shopping for new equipment.,2017-06-29 11:17:23,2018-05-23 11:30:12
438,7483,Economy Grocery Shoppers,,2017-07-06 15:45:18,2017-07-06 15:45:18
439,7527,Democratic Donors,,2017-07-17 17:24:48,2017-07-17 17:24:48
440,7529,Foreman and Construction Managers,Professionals reading foreman and construction industry news.,2017-07-17 17:25:23,2018-05-23 16:19:11
441,7534,Canada Trip Planners,People researching attractions and accommodations in Canada. These consumers are more likely to spend money on travel and local attractions.,2017-07-18 16:24:28,2017-12-27 12:31:08
442,7535,Medicare Provider Researchers,People researching Medicare providers and options.,2017-07-18 16:24:28,2018-05-23 11:30:13
443,7536,Medicare Price Shoppers,People comparing Medicare providers based on price.,2017-07-18 16:24:28,2018-05-23 11:30:13
444,7537,Ecommerce Platform Researchers,People comparing products and services of ecommerce platforms.,2017-07-18 16:24:28,2018-05-23 16:19:11
445,7540,North Carolina Travel Researchers,People researching attractions and accommodations in North Carolina.,2017-07-19 11:24:30,2018-05-23 11:30:13
446,7541,Alabama Trip Planners,"People researching attractions and accommodations in Alabama. These consumers are more likely to spend money on flights, hotels, and local attractions.",2017-07-19 11:24:30,2017-12-07 12:35:47
447,7542,Georgia Trip Planners,"People researching attractions and accommodations in Georgia. These consumers are more likely to spend money on flights, hotels, and local attractions.",2017-07-19 11:24:30,2017-12-07 12:35:47
448,7543,Louisiana Trip Planners,"People researching attractions and accommodations in Louisiana. These consumers are more likely to spend money on flights, hotels, and local attractions.",2017-07-19 11:24:30,2017-12-07 12:35:47
449,7544,Texas Trip Planners,"People researching attractions and accommodations in Texas. These consumers are more likely to spend money on flights, hotels, and local attractions.",2017-07-19 11:24:30,2017-12-07 12:35:47
450,7545,Florida Atlantic Coast Trip Planners,"People researching attractions and accommodations in Florida. These consumers are more likely to spend money on flights, hotels, and local attractions.",2017-07-19 11:24:30,2017-12-07 12:35:47
451,7546,Florida Gulf Coast Travel Researchers,People researching attractions and accommodations in the Florida Gulf Coast area.,2017-07-19 11:24:30,2018-05-23 11:30:12
452,7557,Tailgaters,,2017-07-20 17:31:31,2019-01-16 09:11:30
453,7597,Readers of Spanish Content,People reading news from Spanish media sources.,2017-08-02 11:30:02,2018-05-23 16:19:11
454,7598,Readers of South American Content,People reading news from South American media sources.,2017-08-02 11:30:02,2018-05-23 16:19:11
455,7605,Organic Food Buyers,,2017-08-07 10:00:03,2017-08-07 10:00:03
456,7685,Home Healthcare Researchers,People researching and comparing products and services for home healthcare.,2017-08-24 15:42:48,2017-12-27 12:31:08
457,10007,Mobile Phone Purchase Intenders,Consumers in-market for a mobile phone.,2017-09-12 16:34:57,2018-05-23 11:30:13
458,10008,Japanese Luxury Car Enthusiasts,Consumers reading content about luxury cars from Japan.,2017-09-12 16:39:45,2018-05-23 11:30:12
459,10009,Investment Services Intenders,People researching and comparing investment service providers for personal investments.,2017-09-12 16:39:45,2018-03-05 11:41:17
460,10010,Satellite TV Buyers,Consumers in-market for satellite television.,2017-09-12 16:39:45,2018-05-23 11:30:13
461,10011,Big Box Shoppers,Consumers who shop at big box retailers.,2017-09-12 16:39:45,2018-05-23 11:30:12
462,10249,Loan Comparison Researchers,Consumers researching and comparing loan offerings from different financial institutions.,2017-09-15 16:53:30,2017-12-07 12:35:47
463,12032,Heart Health Researchers,People reading news and advice on preventing and treating heart health issues.,2017-11-16 14:20:02,2017-12-27 12:31:08
464,10250,Halloween Costume Shoppers,Consumers comparing and shopping for Halloween costumes. These consumers are more likely to spend money on costumes for themselves and their kids.,2017-09-15 16:53:30,2017-12-27 12:31:08
465,10251,Personal Bank Comparison Researchers,Consumers researching and comparing personal checking and saving account products from different banks.,2017-09-18 15:07:53,2017-12-07 12:35:47
466,10284,Alaskan Cruise Planners,People researching cruise accommodations for trips to Alaska. These consumers are more likely to spend money on travel and local attractions.,2017-09-20 11:40:01,2017-12-27 12:31:08
467,10326,IT News Readers,People reading industry news and product releases for information technology.,2017-09-21 16:35:42,2017-12-27 12:31:08
468,10351,Military Personal Finance Researchers,People researching personal finance while also demonstrating interest in military related content.,2017-09-25 16:08:34,2018-05-23 11:30:13
469,10364,Documentary Film Fans,People who love watching and reading about documentary films .,2017-09-26 18:05:13,2018-05-23 11:30:12
470,10365,Horror Movie Fans,People interested in watching and reading about horror films .,2017-09-26 18:05:13,2018-05-23 11:30:12
471,10366,Sci-Fi Movie Fans,People who love watching and reading articles about Sci-fi movies.,2017-09-26 18:05:13,2018-05-23 11:30:13
472,10832,Austin Trip Planners,"People researching attractions and accommodations in Austin. These consumers are more likely to spend money on flights, hotels, and local attractions.",2017-10-11 11:16:31,2017-12-07 12:35:47
473,10833,Dallas Trip Planners,"People researching attractions and accommodations in Dallas. These consumers are more likely to spend money on flights, hotels, and local attractions.",2017-10-11 11:16:31,2017-12-07 12:35:47
474,10834,Norfolk and Virginia Beach Trip Planners,"People researching attractions and accommodations in Norfolk and Virginia. These consumers are more likely to spend money on flights, hotels, and local attractions.",2017-10-11 11:16:31,2018-09-07 08:07:27
475,10835,Long Beach California Trip Planners,"People researching attractions and accommodations in Long Beach, California. These consumers are more likely to spend money on flights, hotels, and local attractions.",2017-10-11 11:16:31,2017-12-07 12:35:47
476,10836,Fort Lauderdale Trip Planners,"People researching attractions and accommodations in Fort Lauderdale. These consumers are more likely to spend money on flights, hotels, and local attractions.",2017-10-11 11:16:31,2017-12-07 12:35:47
477,10837,Denver Trip Planners,"People researching attractions and accommodations in Denver. These consumers are more likely to spend money on flights, hotels, and local attractions.",2017-10-11 11:16:31,2017-12-07 12:35:47
478,10838,Detroit Trip Planners,"People researching attractions and accommodations in Detroit. These consumers are more likely to spend money on flights, hotels, and local attractions.",2017-10-11 11:16:31,2017-12-07 12:35:47
479,10839,Tampa and St Petersburg Trip Planners,"People researching attractions and accommodations in Tampa and St Petersburg. These consumers are more likely to spend money on flights, hotels, and local attractions.",2017-10-11 11:16:31,2018-09-07 08:07:48
480,10869,Seattle Seahawks Fans,People reading news about the Seattle Seahawks and watching games. These consumers are more likely to spend money on team gear.,2017-10-16 10:18:46,2017-12-27 12:31:08
481,10870,Philadelphia Eagles Fans,People reading news about the Philadelphia Eagles and watching games. These consumers are more likely to spend money on team gear.,2017-10-16 10:18:46,2017-12-27 12:31:08
482,10871,Dallas Cowboys Fans,People reading news about the Dallas Cowboys and watching games. These consumers are more likely to spend money on team gear.,2017-10-16 10:18:46,2017-12-27 12:31:08
483,10872,Atlanta Falcons Fans,People reading news about the Atlanta Falcons and watching games. These consumers are more likely to spend money on team gear.,2017-10-16 10:18:46,2017-12-27 12:31:08
484,10953,Beard Care Shoppers,Consumers comparing and shopping for beard care products and services.,2017-10-23 12:32:17,2017-12-27 12:31:08
485,10954,Nintendo Enthusiasts,People who love visiting video game websites and reading about Nintendo.,2017-10-23 12:32:18,2018-05-23 11:30:13
486,10955,Pokemon Enthusiasts,People who love visiting video game websites and reading about Pokemon.,2017-10-23 12:32:18,2018-05-23 11:30:13
487,10970,Halloween Decorations Shoppers,Consumers in-market for Halloween decorations.,2017-10-24 10:16:21,2018-05-23 11:30:12
488,10971,Halloween Enthusiasts,People who visit Halloween related websites.,2017-10-24 10:16:21,2018-05-23 11:30:12
489,10972,Halloween Thrill Seekers,People researching Halloween related thrill venues and ideas.,2017-10-24 10:16:21,2018-05-23 11:30:12
490,10973,Family Halloween Party Planners,Consumers in-market for Halloween party supplies and content.,2017-10-24 10:16:21,2018-05-23 11:30:12
491,10974,Thanksgiving Entertaining Researchers,Consumers reading online about Thanksgiving entertaining ideas.,2017-10-24 10:16:21,2018-05-23 11:30:13
492,10975,Thanksgiving Meal Planners,People reading online about Thanksgiving meal ideas.,2017-10-24 10:16:21,2018-05-23 11:30:13
493,10976,Christmas Decorations Shoppers,Consumers in-market for Christmas decorations.,2017-10-24 10:16:21,2018-05-23 11:30:12
494,10977,Christmas Celebration Researchers,People reading online about Christmas celebration ideas.,2017-10-24 10:16:21,2018-05-23 11:30:12
495,10978,Family Christmas Celebration Researchers,People reading online about family focused Christmas celebration ideas.,2017-10-24 10:16:21,2018-05-23 11:30:12
496,10979,Hanukkah Celebration Planners,People researching online about Hanukkah Celebration ideas.,2017-10-24 10:16:21,2018-05-23 11:30:12
497,10980,Hanukkah Decorations Shoppers,Consumers in-market for Hanukkah decorations.,2017-10-24 10:16:21,2018-05-23 11:30:12
498,10981,New Years Eve Party Ticket Purchasers,Consumers in-market for New Years Eve party tickets.,2017-10-24 10:16:21,2018-05-23 11:30:13
499,10988,Santa Monica Trip Planners,"People researching attractions and accommodations in Santa Monica. These consumers are more likely to spend money on flights, hotels, and local attractions.",2017-10-25 12:42:39,2017-12-07 12:35:47
500,11065,Authors,Professionals reading industry news and researching products and services for professional writing.,2017-11-01 10:42:27,2017-12-27 12:31:08
501,11066,Chain Pizzeria Fans,Consumers researching promotions and ordering pizza from online pizza chains.,2017-11-01 10:42:28,2018-05-31 22:11:37
502,11067,NCAA Football Fans,People reading articles and websites about college football and the NCAA.,2017-11-01 10:42:28,2018-05-23 11:30:13
503,11974,Price Conscious Home Shoppers,Consumers shopping for discount home furnishings,2017-11-13 15:15:02,2018-02-26 15:39:59
504,11975,Landscape Architects,Professionals reading industry news and researching products and services for landscape design.,2017-11-13 15:15:04,2017-12-27 12:31:08
505,11977,Civil Engineers,Professionals reading industry news and researching products and services for civil engineering.,2017-11-13 15:15:04,2017-12-27 12:31:08
506,12025,Urban Skateboarding Sneaker Shoppers,Consumers comparing and shopping for trendy urban skateboarding sneakers.,2017-11-16 14:05:02,2017-12-27 12:31:08
507,12026,California Trip Planners,"People researching attractions and accommodations in California. These consumers are more likely to spend money on flights, hotels, and local attractions.",2017-11-16 14:05:02,2017-12-07 12:35:47
508,12027,Gen Z Apparel Shoppers,Consumers comparing and shopping for clothing and accessories popular with Gen Z.,2017-11-16 14:05:02,2017-12-27 12:31:08
509,12031,Neurologists,Professionals reading industry news and researching products and services for neurology.,2017-11-16 14:20:02,2017-12-27 12:31:08
510,12132,Last Minute Travelers,People researching and booking travel accommodations with little to no advanced notice.,2017-11-27 16:45:02,2017-12-27 12:31:08
511,12133,Luxury Boutique Hotel Researchers,"Consumers comparing or purchasing accommodations at luxury, boutique hotels.",2017-11-27 16:45:02,2017-12-07 12:35:47
512,12277,Market Intelligence Researchers,Professionals reading industry news focused on market intelligence.,2017-12-04 17:10:02,2017-12-18 10:57:27
513,12490,Gourmet Food Purchasers,Consumers shopping for gourmet food products and services.,2017-12-14 15:05:02,2018-02-26 15:40:05
514,12602,Family Medical Practice Journal Researchers,People reading news about the Catholic faith.,2017-12-18 12:10:03,2018-12-07 11:59:17
515,12820,Commercial Contractors & Designers,Professionals reading industry news about contracting and designing for commercial properties.,2017-12-21 12:30:02,2018-12-07 11:59:17
516,12821,Commercial Healthcare Hospitality & Retail Designers,Professionals reading industry news about hospitality and retail design for commercial healthcare properties.,2017-12-21 12:30:02,2018-12-07 11:59:17
517,13421,Los Angeles Mass Transit Commuters,People reading news about mass transit systems in Los Angeles and using commuter resources.,2018-01-04 10:25:02,2018-01-04 10:25:02
518,13428,Smoking Cessation Intenders,People researching available products and services to stop smoking cigarettes.,2018-01-04 17:30:02,2018-05-23 16:19:11
519,13496,Professional Chefs,Professionals reading industry news and researching products and services for chefs.,2018-01-08 16:15:02,2018-05-23 16:19:11
520,13497,Restaurant Supply Shoppers,Consumers comparing and shopping for wholesale restaurant food and supplies.,2018-01-08 16:15:02,2018-05-23 16:19:11
521,13498,Restaurant News Readers,Professionals reading industry news and researching products and services for restaurants.,2018-01-08 16:15:02,2018-05-23 16:19:11
522,14800,Rapid City Trip Planners,"People researching attractions and accommodations in Rapid City. These consumers are more likely to spend money on flights, hotels, and local attractions.",2018-01-24 18:25:03,2018-05-23 16:19:11
523,14801,Cryptocurrency Enthusiasts,People reading industry news and following trends on cryptocurrencies.,2018-01-24 18:25:03,2018-01-24 18:25:03
524,14802,Online Bank Researchers,People researching online banks and comparing products and services.,2018-01-24 18:30:02,2018-05-23 16:19:11
525,14895,In-Market Car Shoppers,Consumers shopping for cars on car consolidator search sites.,2018-01-26 15:40:04,2018-03-12 16:42:47
526,14901,Audio Book Listeners,People visiting sites to download audio books and audio content.,2018-01-26 16:20:04,2018-05-23 16:19:11
527,15877,Readers of Pakistani Content,People reading news from Pakistani media sources.,2018-02-02 16:25:03,2018-05-23 16:19:11
528,15878,Readers of Catholic News,People reading news about the Muslim faith.,2018-02-02 16:25:03,2018-12-07 11:59:17
529,15879,Freelancers,Professionals reading industry news and following trends on freelancing.,2018-02-02 16:25:03,2018-02-02 16:25:03
530,15882,Online Role Playing Game Enthusiasts,People researching role playing games and sharing with the community.,2018-02-02 16:25:03,2018-12-07 11:59:17
531,15883,Video and Computer Gaming Enthusiasts,People reading news and following gaming trends.,2018-02-02 16:25:03,2018-12-07 11:59:17
532,15884,Video Gamers,People researching and reading reviews of video games.,2018-02-02 16:25:03,2018-12-07 11:59:17
533,15935,Pregnancy Resources Researchers,People who visit websites and read articles related to pregnancy and childbirth.,2018-02-06 11:45:03,2018-05-31 22:11:37
534,16119,San Diego Trip Planners,"People researching attractions and accommodations in San Diego. These consumers are more likely to spend money on flights, hotels, and local attractions.",2018-02-13 10:50:03,2018-02-13 10:50:03
535,16137,Olympics Fans,People reading news about the Olympics and following the events.,2018-02-13 14:10:03,2018-02-13 14:10:03
536,16138,Special Olympics Fans,People reading news about the Special Olympics and following the events.,2018-02-13 14:10:03,2018-02-13 14:10:03
537,16196,Mexico Trip Planners,"People researching attractions and accommodations in Mexico. These consumers are more likely to spend money on flights, hotels, and local attractions.",2018-02-14 15:50:04,2018-02-14 15:50:04
538,16197,Financial Business Intelligence Researchers,Professionals reading industry news and following financial business intelligence trends.,2018-02-14 15:50:04,2018-02-22 15:26:32
539,16198,World of Warcraft Enthusiasts,People researching World of Warcraft news and following gaming trends.,2018-02-14 15:50:04,2018-12-12 18:21:00
540,17269,At-Home Gym Intenders,Consumers purchasing products and services for exercising at home.,2018-02-27 14:15:03,2018-05-23 16:19:11
541,17271,Car Collector Enthusiasts,People reading news on the collector car market. ,2018-02-27 14:15:03,2018-05-23 16:19:12
542,17274,Readers of Jamaican Content,People reading news from Jamaican media sources.,2018-02-27 14:15:03,2018-05-23 16:19:11
543,17314,Lobbyists,Professionals reading industry news on lobbying.,2018-02-28 11:00:04,2018-12-07 11:59:17
544,17318,Charitable Organization Supporters,People supporting charitable organizations through service and donations.,2018-02-28 11:00:04,2018-12-07 11:59:17
545,17320,March Madness Enthusiasts,People watching college basketball and reading about March Madness.,2018-02-28 11:00:04,2018-02-28 11:00:04
546,17452,Clinic & Lab Immunologist Professionals,Professionals reading industry news and trends on immunology at medical clinics and labs. ,2018-03-01 16:10:03,2018-05-23 16:19:11
547,17540,Vacuum Shoppers,People comparing and shopping for vacuums and vacuum parts.,2018-03-06 16:20:03,2018-03-06 16:20:03
548,17669,Fragrance Shoppers,People shopping for perfume or cologne.,2018-03-09 14:20:03,2018-03-09 14:20:03
