,id,interest_name,interest_summary,created_at,last_modified
549,17670,Deodorant Shoppers,People shopping for deoderant.,2018-03-09 14:20:03,2018-03-09 14:20:03
550,17671,Crypto Market Investors,People researching news and trends on the crypto market.,2018-03-09 14:20:04,2018-03-09 14:20:04
551,17672,Indie Coffee Shoppers,People shopping for coffee products from independent coffee brands.,2018-03-09 14:20:04,2018-05-23 16:19:11
552,17673,Coffee Chain Shoppers,People shopping for coffee products from chains coffee brands.,2018-03-09 14:20:04,2018-05-23 16:19:11
553,17674,Medical Advice Researchers,People researching medical symptoms and seeking advice online.,2018-03-09 14:20:04,2018-12-07 11:59:17
554,17729,Competitive Car Brand Shoppers,People comparing and shopping for competitive economy car brands.,2018-03-12 15:35:03,2018-05-23 11:30:13
555,17730,Luxury Department Store Shoppers,Consumers shopping at luxury department stores.,2018-03-12 15:35:03,2018-12-07 11:59:17
556,17785,Luxury Womens Brands Shoppers,Consumers shopping for clothing and accessories from luxury womens brands.,2018-03-14 11:00:04,2018-12-07 11:59:17
557,17786,Womens Fashion Brands Shoppers,Consumers shopping for clothing and accessories from top womens fashion brands.,2018-03-14 11:00:04,2018-12-07 11:59:17
558,17803,TV Advertising Professionals,Professionals reading industry news and following trends for tv advertising.,2018-03-14 13:35:05,2018-04-11 16:46:51
559,18202,Real Estate Decision Makers,Professionals reading industry news and trends on real estate.,2018-03-21 13:30:04,2018-12-07 11:59:17
560,18203,Hunters,Consumers reading hunting news and shopping for products and equipment for hunting.,2018-03-21 13:30:04,2018-12-07 11:59:17
561,18204,Healthcare Thought Leaders,Professionals reading industry news and sharing information on healthcare.,2018-03-21 13:30:04,2018-05-31 22:11:37
562,18347,Affordable Hotel Bookers,Consumers comparing and booking hotel accommodations at affordable level US hotel chains.,2018-03-26 16:20:05,2018-03-26 16:20:05
563,18348,Sci-Fi Show Watchers,Consumers watching and reading about popular sci-fi television shows.,2018-03-26 16:20:05,2018-05-23 11:30:13
564,18350,Photo Memory Makers,Consumers comparing services and shopping for prodcuts to make creations out of their photographs.,2018-03-26 16:45:03,2018-03-26 16:45:03
565,18351,Drama Show Watchers,Consumers watching and reading about popular drama television shows.,2018-03-26 16:45:03,2018-03-26 16:45:03
566,18352,Pediatric Provider Researchers,People researching healthcare providers and doctors for pedriatric medicine.,2018-03-26 16:45:03,2018-12-12 17:00:06
567,18490,Professional Sound Products Researchers,People researching and shopping for professional sound products.,2018-03-30 16:25:02,2018-03-30 16:25:02
568,18619,Asian Food Enthusiasts,People reading about Asian food and researching recipes.,2018-04-09 12:10:04,2018-04-09 12:10:04
569,18620,Mexican Food Enthusiasts,People reading about Mexican food and researching recipes.,2018-04-09 12:10:04,2018-05-23 11:30:13
570,18621,Italian Food Enthusiasts,People reading about Italian food and researching recipes.,2018-04-09 12:10:05,2018-04-09 12:10:05
571,18622,Las Vegas Nightlife Researchers,People researching nightlife in Las Vegas.,2018-04-09 12:10:05,2018-04-09 12:10:05
572,18646,Recipe Researchers,People researching recipes for at home cooking and entertaining.,2018-04-10 14:55:03,2018-04-10 14:55:03
573,18647,Gourmet Food & Wine Researchers,People researching recipes and trends for gourmet food and wine.,2018-04-10 14:55:03,2018-04-10 14:55:03
574,18648,Architecture Enthusiasts,People reading industry news and following architecture trends.,2018-04-10 14:55:03,2018-04-10 14:55:03
575,18781,Gastroenterology Journal Researchers,People and medical professionals reading gastroenterology journals.,2018-04-16 16:00:03,2018-05-04 15:11:29
576,18782,Internal Medicine Journal Researchers,People and medical professionals reading internal medicine journals.,2018-04-16 16:00:03,2018-05-04 15:11:29
577,18783,Nursing and Physicians Assistant Journal Researchers,People and medical professionals reading nursing and physicians assistant journals.,2018-04-16 16:00:03,2018-05-04 15:11:29
578,18784,Healthcare Provider Education Researchers,People and medical professionals reading family medical practice journals. ,2018-04-16 16:00:03,2018-05-23 16:19:11
579,18807,Food Safety QA Professionals,Professionals reading food safety industry news.,2018-04-17 11:25:03,2018-05-23 16:19:11
580,18923,Online Home Decor Shoppers,Consumers shopping online for home decor available for delivery.,2018-04-19 18:25:02,2018-04-19 18:25:02
581,18924,Commercial Banking Market Intelligence Researchers,Professionals researching market intelligence for commercial banking.,2018-04-19 18:25:02,2018-04-19 18:25:02
582,18995,Commercial Architects and Designers,Professionals reading industry news on commercial architecture and design.,2018-04-23 15:55:03,2018-04-23 15:55:03
583,18996,Investment Banking Professionals,Professionals reading industry news on investment banking.,2018-04-23 15:55:03,2018-04-23 15:55:03
584,18997,Insurance Professionals,Professionals reading industry news on insurance.,2018-04-23 15:55:03,2018-04-23 15:55:03
585,18998,Investment Management Professionals,Professionals reading industry news on investment management.,2018-04-23 15:55:03,2018-04-23 15:55:03
586,19250,World Cup Enthusiasts,People who are fans of international soccer.,2018-05-02 11:00:05,2018-05-02 11:00:05
587,19251,Cinco de Mayo Celebrators,People researching traditions and planning celebrations for Cinco de Mayo.,2018-05-02 11:00:05,2018-05-02 11:00:05
588,19294,Patriotic Party Decoration Shoppers,Consumers shopping for patriotic themed party decorations.,2018-05-03 10:25:02,2018-05-03 10:25:02
589,19295,Fishing Equipment Shoppers,Consumers shopping for fishing equipment.,2018-05-03 10:25:03,2018-05-03 10:25:03
590,19296,BBQ Enthusiasts,People reading trends and techniques on BBQ and shopping for products.,2018-05-03 10:25:03,2018-05-03 10:25:03
591,19297,Alzheimer and Dementia Researchers,People researching information and care for alzheimer and dementia patients.,2018-05-03 10:25:03,2018-05-03 10:25:03
592,19298,Beach Supplies Shoppers,Consumers shopping for beach supplies.,2018-05-03 10:25:03,2018-05-03 10:25:03
593,19338,Summer Activities Researchers,People researching summer activities for their families and kids.,2018-05-03 17:05:05,2018-05-03 17:05:05
594,19422,Home Design and Living Publication Readers,People reading publications focused on design and living at home.,2018-05-08 11:55:03,2018-05-08 11:55:03
595,19423,Kitchen Appliance Shoppers,People shopping for kitchen appliances.,2018-05-08 11:55:03,2018-05-08 11:55:03
596,19519,Property and Facility Managers,Professionals reading industry news and researching products and services for property and facility management.,2018-05-11 12:30:03,2018-05-11 12:30:03
597,19520,Building Service Contractors,Professionals reading industry news and researching products and services for building service contracting.,2018-05-11 12:30:03,2018-05-11 12:30:03
598,19578,Sports Gamblers,"People browsing content related to online
sports betting.",2018-05-15 11:55:04,2019-02-13 17:05:19
599,19579,Hematologists,Professionals reading industry news and researching products for hematology.,2018-05-15 11:55:04,2018-05-15 11:55:04
600,19587,Acura Vehicle Shoppers,People researching and comparing Acura vehicles. These consumers are more likely to spend money on a new or used car.,2018-05-15 14:20:03,2018-05-15 14:20:03
601,19588,Audi Vehicle Shoppers,People researching and comparing Audi vehicles. These consumers are more likely to spend money on a new or used car.,2018-05-15 14:20:03,2018-05-15 14:20:03
602,19589,Auto Body Shoppers,Consumers researching products and services for auto body work.,2018-05-15 14:20:03,2018-05-15 14:20:03
603,19590,Auto Show Enthusiasts,People researching news and viewing online content focused on auto shows and collectible cars.,2018-05-15 14:20:03,2018-05-15 14:20:03
604,19591,Camaro Enthusiasts,People researching and comparing Camaro vehicles. These consumers are more likely to spend money on a new or used car.,2018-05-15 14:20:04,2018-05-15 14:20:04
605,19592,Cigars Shoppers,Consumers researching brands and shopping for cigars.,2018-05-15 14:20:04,2018-05-15 14:20:04
606,19593,Classic Car Shoppers,People researching and comparing classic cars. These consumers are more likely to spend money on car shows and collectible cars.,2018-05-15 14:20:04,2018-05-15 14:20:04
607,19594,Corvette Enthusiasts,People researching and comparing Corvette vehicles. These consumers are more likely to spend money on a new or used car.,2018-05-15 14:20:04,2018-05-15 14:20:04
608,19595,Diesel Vehicle Shoppers,People researching and comparing diesel vehicles. These consumers are more likely to spend money on a new or used car.,2018-05-15 14:20:04,2018-05-15 14:20:04
609,19596,Dirt Bike Enthusiasts,Consumers researching dirt bike racing news and shopping for dirt bikes and riding accessories.,2018-05-15 14:20:04,2018-05-15 14:20:04
610,19597,Disability Insurance Researchers,People researching and comparing disability insurance policies. These consumers are more likely to spend money with insurance companies.,2018-05-15 14:20:04,2018-05-15 14:20:04
611,19598,Doctor Who Fans,"People reading fan sites, promotional material, and news on the Doctor Who series.",2018-05-15 14:20:04,2018-05-15 14:20:04
612,19599,Dodge Vehicle Shoppers,People researching and comparing Dodge vehicles. These consumers are more likely to spend money on a new or used car.,2018-05-15 14:20:04,2018-05-15 14:20:04
613,19600,Ducati Motorcycle Shoppers,People researching and comparing Ducati motorcycles. These consumers are more likely to spend money on a new or used motorcycle.,2018-05-15 14:20:04,2018-05-15 14:20:04
614,35742,Disney Fans,"People reading fan sites, promotional material, and news about Disney entertainment and attractions.",2018-08-31 11:20:04,2018-08-31 11:20:04
615,19601,Ford Mustang Enthusiasts,People researching and comparing Ford Mustang model vehicles. These consumers are more likely to spend money on a new or used car.,2018-05-15 14:20:04,2018-05-15 14:20:04
616,19602,Ford Vehicle Shoppers,People researching and comparing Ford vehicles. These consumers are more likely to spend money on a new or used car.,2018-05-15 14:20:04,2018-05-15 14:20:04
617,19603,France Trip Planners,"People researching attractions and accommodations in France. These consumers are more likely to spend money on flights, hotels, and local attractions.",2018-05-15 14:20:04,2018-05-15 14:20:04
618,19604,Game of Thrones Fans,"People reading fan sites, promotional material, and news on the Game of Thrones books and series.",2018-05-15 14:20:05,2018-05-15 14:20:05
619,19605,Harley Davidson Shoppers,People researching and comparing Harley Davidson vehicles. These consumers are more likely to spend money on a new or used motorcycle.,2018-05-15 14:20:05,2018-05-15 14:20:05
620,19606,Home Networking Researchers,People researching brands and comparing products and services for a home network.,2018-05-15 14:20:05,2018-05-15 14:20:05
621,19607,Home Theater Enthusiasts,People researching brands and comparing products and services for a home theater.,2018-05-15 14:20:05,2018-05-15 14:20:05
622,19608,Honda Vehicle Shoppers,People researching and comparing Honda vehicles. These consumers are more likely to spend money on a new or used car.,2018-05-15 14:20:05,2018-05-15 14:20:05
623,19609,Hyundai Vehicle Shoppers,People researching and comparing Hyundai vehicles. These consumers are more likely to spend money on a new or used car.,2018-05-15 14:20:05,2018-05-15 14:20:05
624,19610,Jaguar Vehicle Shoppers,People researching and comparing Jaguar vehicles. These consumers are more likely to spend money on a new or used car.,2018-05-15 14:20:05,2018-05-15 14:20:05
625,19611,Jeep Vehicle Shoppers,People researching and comparing Jeep vehicles. These consumers are more likely to spend money on a new or used car.,2018-05-15 14:20:05,2018-05-15 14:20:05
626,19612,Kia Vehicle Shoppers,People researching and comparing Kia vehicles. These consumers are more likely to spend money on a new or used car.,2018-05-15 14:20:05,2018-05-15 14:20:05
627,19613,Land Rover Shoppers,People researching and comparing Land Rover vehicles. These consumers are more likely to spend money on a new or used car.,2018-05-15 14:20:05,2018-05-15 14:20:05
628,19614,Mazda Vehicle Shoppers,People researching and comparing Mazda vehicles. These consumers are more likely to spend money on a new or used car.,2018-05-15 14:20:05,2018-05-15 14:20:05
629,19615,Mercedes-Benz Vehicle Shoppers,People researching and comparing Mercedes-Benz vehicles. These consumers are more likely to spend money on a new or used car.,2018-05-15 14:20:05,2018-05-15 14:20:05
630,19616,Muscle Car Shoppers,People researching and comparing muscle cars. These consumers are more likely to spend money on a new or used car.,2018-05-15 14:20:05,2018-05-15 14:20:05
631,19617,Nissan Vehicle Shoppers,People researching and comparing Nissan vehicles. These consumers are more likely to spend money on a new or used car.,2018-05-15 14:20:05,2018-05-15 14:20:05
632,19618,Off Road Accessories Enthusiasts,Consumers researching products and services for off road accessories.,2018-05-15 14:20:06,2018-05-15 14:20:06
633,19619,Pet Food Shoppers,Consumers researching brands and shopping for pet food.,2018-05-15 14:20:06,2018-05-15 14:20:06
634,19620,PlayStation Enthusiasts,People reading news about PlayStation and researching games for the system.,2018-05-15 14:20:06,2018-05-15 14:20:06
635,19621,Portugal Trip Planners,"People researching attractions and accommodations in Portugal. These consumers are more likely to spend money on flights, hotels, and local attractions.",2018-05-15 14:20:06,2018-05-15 14:20:06
636,19622,Quads and ATV Enthusiasts,People researching brands and comparing quads and ATV vehicles. These consumers are more likely to spend money on a new or used ATVs.,2018-05-15 14:20:06,2018-05-15 14:20:06
637,19623,Russia Trip Planners,"People researching attractions and accommodations in Russia. These consumers are more likely to spend money on flights, hotels, and local attractions.",2018-05-15 14:20:06,2018-05-15 14:20:06
638,19624,RV Shoppers,People researching and comparing recreational vehicles and campers. These consumers are more likely to spend money on a new or used RV.,2018-05-15 14:20:06,2018-05-15 14:20:06
639,19625,Sony Fans,People reading news about Sony and researching new product releases.,2018-05-15 14:20:06,2018-05-15 14:20:06
640,19626,Star Trek Fans,"People reading fan sites, promotional material, and news on the Star Trek franchise.",2018-05-15 14:20:06,2018-05-15 14:20:06
641,19627,Subaru Vehicle Shoppers,People researching and comparing Subaru vehicles. These consumers are more likely to spend money on a new or used car.,2018-05-15 14:20:06,2018-05-15 14:20:06
642,19628,Oral Hygiene Shoppers,Consumers researching brands and shopping for oral hygiene products.,2018-05-15 14:20:06,2018-05-15 14:20:06
643,19629,Tiny Home Researchers,People researching and comparing products and services for tiny homes.,2018-05-15 14:20:06,2018-05-15 14:20:06
644,19630,Toyota Vehicle Shopper,People researching and comparing Toyota vehicles. These consumers are more likely to spend money on a new or used car.,2018-05-15 14:20:06,2018-05-15 14:20:06
645,19631,Tractor Shoppers,People researching and comparing tractors. These consumers are more likely to spend money on a new or used tractors and accessories.,2018-05-15 14:20:06,2018-05-15 14:20:06
646,19632,Truck Shoppers,People researching and comparing truck models. These consumers are more likely to spend money on a new or used car.,2018-05-15 14:20:07,2018-05-15 14:20:07
647,19633,UFC and MMA Fans,Active fans of the Ultimate Fighting Championship and Mixed Martial Arts.,2018-05-15 14:20:07,2018-05-15 14:20:07
648,19634,Volkswagen Vehicle Shopper,People researching and comparing Volkswagen vehicles. These consumers are more likely to spend money on a new or used car.,2018-05-15 14:20:07,2018-05-15 14:20:07
649,19635,Xbox Enthusiasts,People reading news about Xbox and researching games for the system.,2018-05-15 14:20:07,2018-05-15 14:20:07
650,19757,Natural Pet Food Shoppers,Consumers researching and shopping for natural pet food.,2018-05-17 17:30:03,2018-05-17 17:30:03
651,19758,Dog Lovers,People reading about dogs and shopping for pet products and services.,2018-05-17 17:30:03,2018-05-17 17:30:03
652,19759,Pet Lovers,People reading about pets and shopping for pet products and services.,2018-05-17 17:30:03,2018-05-17 17:30:03
653,19760,Cat Lovers,People reading about cats and shopping for pet products and services.,2018-05-17 17:30:04,2018-05-17 17:30:04
654,19878,Coin Collectors,People researching rare coins and purchasing products for their collection.,2018-05-21 17:40:05,2018-05-21 17:40:05
655,19879,Personal Investment Researchers,People researching products and services for personal investments.,2018-05-21 17:40:05,2018-05-21 17:40:05
656,20730,Readers of Chinese Content,People reading news from Chinese media sources.,2018-05-29 11:00:03,2018-05-29 11:00:03
657,20731,Readers of South Asian Content,People reading news from South Asian media sources.,2018-05-29 11:00:03,2018-05-29 11:00:03
658,20750,BMW Vehicle Shoppers,People researching and comparing BMW vehicles. These consumers are more likely to spend money on a new or used car.,2018-05-29 15:00:03,2018-07-02 13:02:57
659,20751,Commercial Vehicles Shoppers,People researching and comparing commercial vehicles. These consumers are more likely to spend money on a new or used commercial vehicle.,2018-05-29 15:00:04,2018-05-29 15:00:04
660,20752,Commercial Truck Researchers,People researching and comparing commercial trucks. These consumers are more likely to spend money on a new or used commercial truck.,2018-05-29 15:00:04,2018-05-29 15:00:04
661,20753,Tesla Enthusiasts,People researching Tesla vehicles and news on alternative fuel vehicles. These consumers are more likely to spend money on a new or alternative fuel car.,2018-05-29 15:00:04,2018-05-29 15:00:04
662,20754,Used Car Shoppers,People researching and comparing used cars. These consumers are more likely to spend money on a used car.,2018-05-29 15:00:04,2018-05-29 15:00:04
663,20755,Movie Ticket Buyers,People searching movie times and purchasing tickets online.,2018-05-29 15:00:04,2018-05-29 15:00:04
664,20756,The Walking Dead Fans,"People reading fan sites, promotional material, and news on The Walking Dead comics and series.",2018-05-29 15:00:04,2018-05-29 15:00:04
665,20764,Entertainment Industry Decision Makers,Professionals reading industry news and researching trends in the entertainment industry.,2018-05-29 18:30:06,2018-05-29 18:30:06
666,20766,Senior Living Center Researchers,People researching senior living centers and comparing services and facilities.,2018-05-29 18:30:06,2018-05-29 18:30:06
667,20767,Beer Lovers,Consumers researching beer companies and purchasing beer online.,2018-05-29 18:30:06,2018-05-29 18:30:06
668,20768,Beer Aficionados,People researching beer companies and purchasing craft beers. These consumers are more likely to purchase home brewing products and visit breweries.,2018-05-29 18:30:06,2018-05-29 18:30:06
669,20814,Boston Celtics Fans,People reading news about the Boston Celtics and watching games. These consumers are more likely to spend money on team gear.,2018-05-30 19:20:05,2018-05-30 19:20:05
670,20815,Cleveland Cavaliers Fans,People reading news about the Cleveland Cavaliers and watching games. These consumers are more likely to spend money on team gear.,2018-05-30 19:20:05,2018-05-30 19:20:05
671,20816,Houston Rockets Fans,People reading news about the Houston Rockets and watching games. These consumers are more likely to spend money on team gear.,2018-05-30 19:20:05,2018-05-30 19:20:05
672,20817,Golden State Warriors Fans,People reading news about the Golden State Warriors and watching games. These consumers are more likely to spend money on team gear.,2018-05-30 19:20:06,2018-05-30 19:20:06
673,20963,Natural and Holistic Health Researchers,People researching trends and products for natural and holistic health care.,2018-06-05 12:45:05,2018-06-05 12:45:05
674,21057,Work Comes First Travelers,People looking to book a hotel who travel frequently for business and vacation.,2018-06-06 16:50:02,2018-06-06 16:50:02
675,21058,Countdown to the Beach Travelers,People looking to book a hotel for the ultimate relaxation vacation.,2018-06-06 16:50:03,2018-06-06 16:50:03
676,21059,Executive Travelers,People looking to book a four-star hotel for a vacation escape from their high-stress jobs.,2018-06-06 16:50:03,2018-06-06 16:50:03
677,21060,Family Adventures Travelers,People looking to book a rental home for a family-oriented vacation.,2018-06-06 16:50:03,2018-06-06 16:50:03
678,21061,"Work Hard, Play Hard Travelers",People looking to book a rental home for a young professional friend group vacation.,2018-06-06 16:50:03,2018-06-06 16:50:03
679,21062,Getting Off the Grid Travelers,People looking to book a rental home who want to be in the wilderness and close to nature,2018-06-06 16:50:03,2018-06-06 16:50:03
680,21236,Arsenal Fans,People reading news about the Arsenal football club and watching games. These consumers are more likely to spend money on team gear.,2018-06-11 17:50:03,2018-06-11 17:50:03
681,21237,Chelsea Fans,People reading news about the Chelsea football club and watching games. These consumers are more likely to spend money on team gear.,2018-06-11 17:50:03,2018-06-11 17:50:03
682,21238,Manchester United Fans,People reading news about the Manchester United football club and watching games. These consumers are more likely to spend money on team gear.,2018-06-11 17:50:03,2018-06-11 17:50:03
683,21239,FC Barcelona Fans,People reading news about the Barcelona football club and watching games. These consumers are more likely to spend money on team gear.,2018-06-11 17:50:03,2018-06-11 17:50:03
684,21240,Italian Mens National Soccer Team Fans,People reading news about the Italian Mens national soccer team and watching games. These consumers are more likely to spend money on team gear.,2018-06-11 17:50:04,2018-06-11 17:50:04
685,21241,Premier League Fans,People reading news about the Premier League and watching games. These consumers are more likely to spend money on team gear.,2018-06-11 17:50:04,2018-06-11 17:50:04
686,21242,World Cup Apparel Shoppers,Consumers shopping for World Cup apparel and team gear for teams competing in the World Cup.,2018-06-11 17:50:04,2018-06-11 17:50:04
687,21243,Readers of Costa Rican Content,People reading news from Costa Rican media sources.,2018-06-11 17:50:04,2018-06-11 17:50:04
688,21244,Readers of Guatemalan Content,People reading news from Guatemalan media sources.,2018-06-11 17:50:04,2018-06-11 17:50:04
689,21245,Readers of Honduran Content,People reading news from Honduran media sources.,2018-06-11 17:50:04,2018-06-11 17:50:04
690,21246,Readers of El Salvadoran Content,People reading news from El Salvadoran media sources.,2018-06-11 17:50:04,2018-06-11 17:50:04
691,21247,Readers of Nicaraguan Content,People reading news from Nicaraguan media sources.,2018-06-11 17:50:04,2018-06-11 17:50:04
692,21248,Readers of Panamanian Content,People reading news from Panamanian media sources.,2018-06-11 17:50:04,2018-06-11 17:50:04
693,21249,Readers of Dominican Republic Content,People reading news from Dominican Republic media sources.,2018-06-11 17:50:04,2018-06-11 17:50:04
694,21250,Readers of Colombian Content,People reading news from Colombian media sources.,2018-06-11 17:50:04,2018-06-11 17:50:04
695,21251,Readers of Belizean Content,People reading news from Belizean media sources.,2018-06-11 17:50:04,2018-06-11 17:50:04
696,21292,Smart Home Product Researchers,Consumers comparing and shopping for smart home products.,2018-06-12 11:45:03,2018-06-12 11:45:03
697,21293,Home Wifi Researchers,Consumers comparing and shopping for whole home wifi products.,2018-06-12 11:45:03,2018-06-12 11:45:03
698,21326,Video Game Shoppers,Consumers researching and purchasing video games.,2018-06-12 14:35:03,2018-06-12 14:35:03
699,22091,Zoo Visitors,People researching zoos and planning a visit.,2018-06-18 18:40:03,2018-06-18 18:40:03
700,22092,Water Park Visitors,People researching water parks and planning a visit.,2018-06-18 18:40:03,2018-06-18 18:40:03
701,22093,Childrens Museum Visitors,People researching childrens museums and planning a visit.,2018-06-18 18:40:03,2018-06-18 18:40:03
702,22094,Fireworks Enthusiasts,People researching where to purchase fireworks and see firework displays.,2018-06-18 18:40:03,2018-06-18 18:40:03
703,22095,Hiking Enthusiasts,"People researching hiking trails, planning hikes, and purchasing gear.",2018-06-18 18:40:03,2018-06-18 18:40:03
704,22096,Camping Enthusiasts,"People researching camping sites, planning camping trips, and purchasing gear.",2018-06-18 18:40:04,2018-06-18 18:40:04
705,22398,Vaping Shoppers,Consumers researching products and brands for vaping.,2018-06-21 14:15:03,2018-06-21 14:15:03
706,22400,Oil Brand Shoppers,Consumers shopping for name brand automotive oil.,2018-06-21 14:15:03,2018-06-21 14:15:03
707,22401,As Seen on TV Shoppers,Consumers shopping for items advertising on television with a direct response mail-order or toll-free telephone number.,2018-06-21 14:15:03,2018-06-21 14:15:03
708,22403,Pandora Jewelry Shoppers,Consumers shopping for jewelry from Pandora.,2018-06-21 14:15:04,2018-06-21 14:15:04
