,id,interest_name,interest_summary,created_at,last_modified
0,1,Fitness Enthusiasts,Consumers using fitness tracking apps and websites.,2016-05-26 14:57:59,2018-05-23 11:30:12
1,2,Gamers,Consumers researching game reviews and cheat codes.,2016-05-26 14:57:59,2018-05-23 11:30:12
2,3,Car Enthusiasts,Readers of automotive news and car reviews.,2016-05-26 14:57:59,2018-05-23 11:30:12
3,4,Luxury Retail Researchers,Consumers researching luxury product reviews and gift ideas.,2016-05-26 14:57:59,2018-05-23 11:30:12
4,5,Brides & Wedding Planners,People researching wedding ideas and vendors.,2016-05-26 14:57:59,2018-05-23 11:30:12
5,6,Vacation Planners,Consumers reading reviews of vacation destinations and accommodations.,2016-05-26 14:57:59,2018-05-23 11:30:13
6,7,Motorcycle Enthusiasts,Readers of motorcycle news and reviews.,2016-05-26 14:57:59,2018-05-23 11:30:13
7,8,Business News Readers,Readers of online business news content.,2016-05-26 14:57:59,2018-05-23 11:30:12
8,12,Thrift Store Shoppers,Consumers shopping online for clothing at thrift stores and researching locations.,2016-05-26 14:57:59,2018-03-16 13:14:00
9,13,Advertising Professionals,People who read advertising industry news.,2016-05-26 14:57:59,2018-05-23 11:30:12
10,14,NFL Fans,People reading articles and websites about football and the NFL.,2016-05-26 14:57:59,2018-05-23 11:30:13
11,15,NBA Fans,People reading articles and websites about basketball and the NBA.,2016-05-26 14:57:59,2018-05-23 11:30:13
12,16,NCAA Fans,People reading articles and websites about college sports and the NCAA.,2016-05-26 14:57:59,2018-05-23 11:30:13
13,17,MLB Fans,People reading articles and websites about baseball and the MLB.,2016-05-26 14:57:59,2018-05-23 11:30:13
14,18,Nascar Fans,People reading articles and websites about nascar.,2016-05-26 14:57:59,2018-05-23 11:30:13
15,19,Eco-Conscious Consumers,People researching climate change and sustainable living.,2016-05-26 14:57:59,2018-05-23 11:30:12
16,20,Moviegoers,Consumers researching box office listings and buying movie tickets.,2016-05-26 14:57:59,2018-05-23 11:30:13
17,21,DIYers,Consumers researching DIY projects.,2016-05-26 14:57:59,2018-05-23 11:30:12
18,22,Grill Masters,Grill owners researching new recipes.,2016-05-26 14:57:59,2018-05-23 11:30:12
19,23,Techies,Readers of tech news and gadget reviews.,2016-05-26 14:57:59,2018-05-23 11:30:13
20,24,Home Design Enthusiasts,Consumers researching home design styles and trends.,2016-05-26 14:57:59,2018-05-23 11:30:12
21,25,Doctors,People reading medical journals and using online prescribing services.,2016-05-26 14:57:59,2018-05-23 11:30:12
22,26,Streaming Video Fans,Consumers streaming feature length movies and TV shows.,2016-05-26 14:57:59,2018-05-23 11:30:13
23,27,Auto Insurance Shoppers,Consumers shopping for auto insurance.,2016-05-26 14:57:59,2018-05-23 11:30:12
24,28,Teachers,People reading education industry publications and teaching advice websites.,2016-05-26 14:57:59,2018-05-23 11:30:13
25,29,College Students,People visiting university websites.,2016-05-26 14:57:59,2018-05-23 11:30:12
26,30,Department Store Shoppers,Consumes shopping at multi-category department stores.,2016-05-26 14:57:59,2018-05-23 11:30:12
27,31,Home Decor Shoppers,"Consumers shopping for home design, art and accessories.",2016-05-26 14:57:59,2018-05-23 11:30:12
28,33,Kids Clothing Shoppers,Consumers shopping for childrens apparel.,2016-05-26 14:57:59,2018-05-23 11:30:12
29,34,Teen Girl Clothing Shoppers,Consumers in-market for clothing for teenage girls.,2016-05-26 14:57:59,2018-05-23 11:30:13
30,35,Mens Clothing Shoppers,Consumers in-market for mens clothing.,2016-05-26 14:57:59,2018-05-23 11:30:13
31,36,Baby Products Buyers,Consumers shopping for baby-related products.,2016-05-26 14:57:59,2018-05-23 11:30:12
32,37,Jewelry & Watch Shoppers,Consumers researching high-end watch and jewelry brands.,2016-05-26 14:57:59,2018-05-23 11:30:12
33,38,Sporting Goods Shoppers,Consumers shopping for sporting goods and activewear apparel.,2016-05-26 14:57:59,2018-05-23 11:30:13
34,39,Furniture Shoppers,Consumers shopping for major home furnishings.,2016-05-26 14:57:59,2018-05-23 11:30:12
35,40,Bed & Bath Shoppers,Consumers shopping for bed and bath products.,2016-05-26 14:57:59,2018-05-23 11:30:12
36,41,Intimates Shoppers,Consumers shopping for lingerie.,2016-05-26 14:57:59,2018-05-23 11:30:12
37,42,Fast Fashion Shoppers,Consumers shopping for apparel that mimics current runway trends.,2016-05-26 14:57:59,2018-05-23 11:30:12
38,43,Apartment Hunters,People reading real estate rental listings.,2016-05-26 14:57:59,2018-05-23 11:30:12
39,44,Home Buyers,People reading real estate sales listings.,2016-05-26 14:57:59,2018-05-23 11:30:12
40,45,Moving Services Shoppers,Consumers who are shopping for moving services.,2016-05-26 14:57:59,2018-05-23 11:30:13
41,46,Job Seekers,People researching job boards.,2016-05-26 14:57:59,2018-05-23 11:30:12
42,48,Charitable Donors,People researching major charitable organizations.,2016-05-26 14:57:59,2018-05-23 11:30:12
43,49,NHL Fans,People reading articles and websites about hockey and the NHL.,2016-05-26 14:57:59,2018-05-23 11:30:13
44,50,Discount Big Box Shoppers,Consumers shopping at big box retailers.,2016-05-26 14:57:59,2018-05-23 11:30:12
45,51,Black Friday Deal Shoppers,Consumers researching holiday sales events.,2016-05-26 14:57:59,2018-05-23 11:30:12
46,53,Hip Hop Fans,People reading about hip hop music and hip hop stars.,2016-05-26 14:57:59,2018-05-23 11:30:12
47,54,Online Investors,Consumers with an active online trading account.,2016-05-26 14:57:59,2018-05-23 11:30:13
48,55,Seasonal Allergy Sufferers,People researching allergy trends and treatment options.,2016-05-26 14:57:59,2018-05-23 11:30:13
49,56,Discount Device Shoppers,Consumers shopping for discounted electronics.,2016-05-26 14:57:59,2018-05-23 11:30:12
50,57,Mobile Phone Comparison Shoppers,Consumers researching alternative mobile phones and wireless plans.,2016-05-26 14:57:59,2018-05-23 11:30:13
51,58,Budget Wireless Shoppers,Consumers researching discount wireless service plans.,2016-05-26 14:57:59,2018-05-23 11:30:12
52,59,Menopause Researchers,People researching menopause symptoms.,2016-05-26 14:57:59,2018-05-23 11:30:13
53,60,Online Health Researchers,People researching general health questions.,2016-05-26 14:57:59,2018-05-23 11:30:13
54,61,Beauty & Skincare Buyers,Consumers shopping for beauty and skincare products.,2016-05-26 14:57:59,2018-05-23 11:30:12
55,62,Streaming Device Shoppers,Consumers shopping for connected TV products.,2016-05-26 14:57:59,2018-05-23 11:30:13
56,63,New & Expecting Parents,People researching pregnancy issues and baby names.,2016-05-26 14:57:59,2018-05-23 11:30:13
57,64,High-End Kids Furniture and Clothes Shoppers,People shopping at high end childrens clothing and toy retailers.,2016-05-26 14:57:59,2018-05-23 11:30:12
58,65,Hands-On Parents,"People reading about family cooking, parenting advice and childrens activities.",2016-05-26 14:57:59,2018-05-23 11:30:12
59,66,Fantasy & Comic Fans,Consumers of online comics and fantasy novels.,2016-05-26 14:57:59,2018-05-23 11:30:12
60,67,Lawyers,People reading legal journals and industry publications.,2016-05-26 14:57:59,2018-05-23 11:30:12
61,69,Healthy Eaters,People researching healthy eating options.,2016-05-26 14:57:59,2018-05-23 11:30:12
62,70,Drug Store Shoppers,Consumers shopping online or searching for a local drug store.,2016-05-26 14:57:59,2018-05-23 11:30:12
63,71,Lawn & Garden Enthusiasts,Consumers reseraching lawn and garden maintenance techniques.,2016-05-26 14:57:59,2018-05-23 11:30:12
64,72,Nurses,People reading websites about nursing lifestyle and career advice.,2016-05-26 14:57:59,2018-05-23 11:30:13
65,73,Mailing & Shipping Shoppers,Consumers shopping for shipping supplies and postage.,2016-05-26 14:57:59,2018-05-23 11:30:12
66,74,Office Supply Shoppers,Individuals in-market for office supplies.,2016-05-26 14:57:59,2018-05-23 11:30:13
67,75,Ink & Toner Shoppers,Consumers shopping for printer ink.,2016-05-26 14:57:59,2018-05-23 11:30:12
68,77,Luxury Retail Shoppers,Consumers shopping for high end fashion apparel and accessories.,2016-05-26 14:57:59,2018-05-23 11:30:12
69,78,Contractors & Construction Professionals,People reading contractor trade publications.,2016-05-26 14:57:59,2018-05-23 11:30:12
70,79,Luxury Travel Researchers,Consumers reading online reviews of luxury travel options.,2016-05-26 14:57:59,2018-05-23 11:30:12
71,80,Democrats,People reading Democratic party advocacy websites.,2016-05-26 14:57:59,2018-05-23 11:30:12
72,81,Republicans,People reading Republican party advocacy websites.,2016-05-26 14:57:59,2018-05-23 11:30:13
73,82,HDTV Researchers,Consumers shopping for a new TV.,2016-05-26 14:57:59,2018-05-23 11:30:12
74,83,Hardware Shoppers,Consumers shopping at hardware and home supply stores.,2016-05-26 14:57:59,2018-05-23 11:30:12
75,84,Reggaeton Fans,People reading about reggaeton music and culture.,2016-05-26 14:57:59,2018-05-23 11:30:13
76,85,Online Movie Downloaders,Consumers downloading feature length movies and TV shows.,2016-05-26 14:57:59,2018-05-23 11:30:13
77,86,Sale Seekers,Consumers researching sales events and special offers.,2016-05-26 14:57:59,2018-05-23 11:30:13
78,87,Theme Park Researchers,Consumers reading online reviews of theme parks and accommodations.,2016-05-26 14:57:59,2018-05-23 11:30:13
79,88,Ski and Snowboard Enthusiasts,Consumers reading reviews of ski resorts and snow reports.,2016-05-26 14:57:59,2019-01-16 09:11:30
80,89,Travel Researchers,Consumers reading reviews of travel destinations.,2016-05-26 14:57:59,2018-05-23 11:30:13
81,90,Coupon Researchers,Consumers researching sales and discount codes.,2016-05-26 14:57:59,2018-05-23 11:30:12
82,91,Parents with Toddlers,People shopping for infant and toddler supplies.,2016-05-26 14:57:59,2018-05-23 11:30:13
83,92,Parents with Kids,People reading about activities for young children.,2016-05-26 14:57:59,2018-05-23 11:30:13
84,93,Young Boomers,People researching sending children to college.,2016-05-26 14:57:59,2018-05-23 11:30:13
85,94,Day Care Users,People researching daycare options.,2016-05-26 14:57:59,2018-05-23 11:30:12
86,95,Stay-at-Home Parents,People reading about child raising advice and activities.,2016-05-26 14:57:59,2018-05-23 11:30:13
87,96,Exercise and Gym Researchers,People researching gyms and health clubs.,2016-05-26 14:57:59,2018-05-23 11:30:12
88,97,Home Kitchen Chefs,Consumers researching recipes.,2016-05-26 14:57:59,2018-05-23 11:30:12
89,98,Restaurant Researchers,Consumers researching local restaurant reviews.,2016-05-26 14:57:59,2018-05-23 11:30:13
90,99,Order-in Eaters,Consumers who order food delivery.,2016-05-26 14:57:59,2018-05-23 11:30:13
91,100,Nutrition Conscious Eaters,Consumer reading about healthy eating options.,2016-05-26 14:57:59,2018-05-23 11:30:13
92,101,Flower & Gift Basket Shoppers,Consumers shopping for flowers and gift baskets.,2016-05-26 14:57:59,2018-05-23 11:30:12
93,102,Plus Size Women,Consumers shopping for plus size womens apparel.,2016-05-26 14:57:59,2018-05-23 11:30:13
94,103,Live Concert Fans,Consumers researching live concerts and music festivals.,2016-05-26 14:57:59,2018-05-23 11:30:12
95,104,Country Music Fans,People reading about country music and country music stars.,2016-05-26 14:57:59,2018-05-23 11:30:12
96,106,Comedy Fans,Consumers of online comedy videos and articles.,2016-05-26 14:57:59,2018-05-23 11:30:12
97,107,Cruise Travel Intenders,Consumers visiting cruise comparison and planning sites.,2016-05-26 14:57:59,2018-05-23 11:30:12
98,108,Pain Medication Users,People researching pain medication options.,2016-05-26 14:57:59,2018-05-23 11:30:13
99,109,Joint Pain Sufferers,People researching joint pain treatment options.,2016-05-26 14:57:59,2018-05-23 11:30:12
100,110,Pain Management Researchers,People researching chronic pain treatment options.,2016-05-26 14:57:59,2018-05-23 11:30:13
101,111,Retirement Planners,People researching retirement living options.,2016-05-26 14:57:59,2018-05-23 11:30:13
102,112,Auto Repair Researchers,Drivers researching how to maintain their cars.,2016-05-26 14:57:59,2018-05-23 11:30:12
103,113,Avid Readers,Readers researching books and long form journalism.,2016-05-26 14:57:59,2018-05-23 11:30:12
104,114,Womens Fashion Magazine Readers,Consumers researching trending womens apparel.,2016-05-26 14:57:59,2018-05-23 11:30:13
105,115,Mens Shoe Shoppers,Consumers in-market for mens shoes.,2016-05-26 14:57:59,2018-05-23 11:30:13
106,116,Home Security Shoppers,Consumers shopping for a home security system.,2016-05-26 14:57:59,2018-05-23 11:30:12
107,117,Boxing Fans,People reading articles and websites about the sport of boxing.,2016-05-26 14:57:59,2018-05-23 11:30:12
108,118,Sleep Disorder Researchers,People researching sleep loss disorders and treatment options.,2016-05-26 14:57:59,2018-05-23 11:30:13
109,119,Mortgage Researchers,People comparing mortgage offers.,2016-05-26 14:57:59,2018-05-23 11:30:13
110,121,Coders & Developers,People reading about software development techniques and products.,2016-05-26 14:57:59,2018-05-23 11:30:12
111,123,Military Servicemembers & Veterans,People visiting websites about military benefits.,2016-05-26 14:57:59,2018-05-23 11:30:13
112,124,Healthcare Discount Shoppers,Consumers researching discounted and tax-free drug offers.,2016-05-26 14:57:59,2018-05-23 11:30:12
113,125,Postal Employees,People buying postal employee uniforms and equipment,2016-05-26 14:57:59,2016-10-28 15:50:51
114,126,Soccer Fans,People who love visiting websites and reading about soccer.,2016-05-26 14:57:59,2018-05-23 11:30:13
115,128,Kitchen & Bathroom Remodelers,Consumers researching kitchen and bath design.,2016-05-26 14:57:59,2018-05-23 11:30:12
116,129,Aftermarket Accessories Shoppers,Consumers shopping for car maintenance products.,2016-05-26 14:57:59,2018-05-23 11:30:12
117,130,Automotive Safety Researchers,Consumers researching car safety ratings.,2016-05-26 14:57:59,2018-05-23 11:30:12
118,131,Android Fans,Readers of Android news and product reviews.,2016-05-26 14:57:59,2018-05-23 11:30:12
119,132,Apple Fans,Readers of Apple news and product reviews.,2016-05-26 14:57:59,2018-05-23 11:30:12
120,133,High End Camera Shoppers - Dupe,Consumers shopping for high end cameras and camera accessories.,2016-05-26 14:57:59,2018-08-22 18:16:37
121,134,Home Printer Shoppers,Consumers shopping for a printer.,2016-05-26 14:57:59,2018-05-23 11:30:12
122,135,Major Appliance Shoppers,Consumers shopping for major home appliances.,2016-05-26 14:57:59,2018-05-23 11:30:12
123,136,Tablet Researchers,Consumers reading reviews and comparing tablet devices.,2016-05-26 14:57:59,2018-05-23 16:19:11
124,137,Online Alcohol Shoppers,Consumers shopping for wine and liquor online.,2016-05-26 14:57:59,2018-05-23 11:30:13
125,138,Home Kitchen Bakers,Consumers researching home baking recipes.,2016-05-26 14:57:59,2018-05-23 11:30:12
126,139,Makeup Researchers,People reading about new beauty products.,2016-05-26 14:57:59,2018-05-23 11:30:12
127,140,Pet Owners,People shopping for pet food and researching pet wellness.,2016-05-26 14:57:59,2018-05-23 11:30:13
128,141,Skin Care Researchers,People reading about skin care techniques.,2016-05-26 14:57:59,2018-05-23 11:30:13
129,142,Credit Card Researchers,Consumers comparing credit card offers.,2016-05-26 14:57:59,2018-05-23 11:30:12
130,143,Health Insurance Researchers,Consumers researching healthcare options.,2016-05-26 14:57:59,2018-05-23 11:30:12
131,145,Property Insurance Researchers,Consumers researching property and homeowner insurance options.,2016-05-26 14:57:59,2018-05-23 11:30:13
132,146,Audio Equipment Researchers,Consumers reading reviews of high end stereo equipment.,2016-05-26 14:57:59,2018-05-23 11:30:12
133,147,Broadway Fans,People researching Broadway show reviews and shopping for tickets.,2016-05-26 14:57:59,2018-05-23 11:30:12
134,148,Celebrity Gossip Fans,Readers of online celebrity gossip websites.,2016-05-26 14:57:59,2018-05-23 11:30:12
135,149,Streaming Radio Listeners,Consumers listening to online streaming music services.,2016-05-26 14:57:59,2018-05-23 11:30:13
136,150,TV Junkies,Consumers researching TV listings.,2016-05-26 14:57:59,2018-05-23 11:30:13
137,151,Big & Tall Men,Consumers shopping for big and tall mens apparel.,2016-05-26 14:57:59,2018-05-23 11:30:12
138,153,Phone Accessory Shoppers,Consumers in-market for phone accessories.,2016-05-26 14:57:59,2018-05-23 11:30:13
139,154,Prepaid Smartphone Shoppers,Consumers in-market for a prepaid smartphone.,2016-05-26 14:57:59,2018-05-23 11:30:13
140,155,Business Travelers,Users of business travel planning and expense reimbursement tools.,2016-05-26 14:57:59,2018-05-23 11:30:12
141,157,Car Rental Shoppers,Consumers making online rental car bookings.,2016-05-26 14:57:59,2018-05-23 11:30:12
142,158,Flight and Hotel Shoppers,Consumers using online airfare comparison tools.,2016-05-26 14:57:59,2018-05-23 11:30:12
143,160,Sightseeing Travelers,Consumers reading online reviews of local attractions and tours.,2016-05-26 14:57:59,2018-05-23 11:30:13
144,161,Travel Reward Points Enthusiasts,Consumers comparing travel rewards programs.,2016-05-26 14:57:59,2018-05-23 11:30:13
145,162,Retirees,People using online retirement discount and health benefits services.,2016-05-26 14:57:59,2018-05-23 11:30:13
146,163,Federal Employees,People visiting government employee benefits websites.,2016-05-26 14:57:59,2018-05-23 11:30:12
147,164,Conservative News Readers,People reading right-leaning financial news websites.,2016-05-26 14:57:59,2018-05-23 11:30:12
148,165,Liberal News Readers,People reading left-leaning financial news websites.,2016-05-26 14:57:59,2018-05-23 11:30:12
149,166,Doves,People reading anti-war publications,2016-05-26 14:57:59,2017-10-20 11:11:02
150,168,Social Conservatives,People reading right-leaning social issues websites.,2016-05-26 14:57:59,2018-05-23 11:30:13
151,169,Social Liberals,People reading left-leaning social issues websites.,2016-05-26 14:57:59,2018-05-23 11:30:13
152,170,Voters,People researching voter registration options.,2016-05-26 14:57:59,2018-05-23 11:30:13
153,171,Shoe Shoppers,Consumers shopping for mass market shoes.,2016-05-26 14:57:59,2018-05-23 11:30:13
154,4847,Readers of Hispanic Content,People reading news from Hispanic media sources.,2016-06-09 16:28:11,2018-05-23 16:19:11
155,4848,Working Parents,People with young children researching daycare options.,2016-06-09 16:28:11,2017-12-27 12:31:08
156,4852,Health & Fitness,,2016-06-09 16:28:11,2017-03-28 11:55:09
157,4855,Entertainment & Tabloid Magazine Readers,Avid readers of online content about the entertainment industry.,2016-06-09 16:28:11,2017-12-07 12:35:47
158,4857,Business Accounting Software Researchers,Professionals researching accounting software products.,2016-06-09 16:28:11,2018-05-23 11:30:12
159,4858,Business Filing Researchers,Professionals researching products and services to file a business.,2016-06-09 16:28:11,2018-05-23 11:30:12
160,4859,Business Logistics Managers,Professionals responsible for day-to-day business logistics.,2016-06-09 16:28:11,2018-05-23 11:30:12
161,4861,IT Decision Makers,Professionals researching and comparing IT solutions.,2016-06-09 16:28:11,2018-05-23 11:30:12
162,4866,Small Business Employees,,2016-06-09 16:28:11,2018-02-27 14:07:23
163,4867,Sweepstakes Enthusiasts,Consumers visiting sweepstakes sites.,2016-06-09 16:28:11,2018-05-23 11:30:13
164,4869,Womens Fitness Enthusiasts,Consumers researching health and fitness trends and techniques for women.,2016-06-09 16:28:11,2018-05-23 11:30:13
165,4870,Tech-Savvy Moms,People reading tech sites geared to mothers.,2016-06-09 16:28:11,2018-05-23 11:30:13
166,4872,Readers of Mexican Content,People reading news from Mexican media sources.,2016-06-09 16:28:11,2018-12-07 11:59:17
167,4873,TV Game Show Fans,People searching for and watching TV game shows online.,2016-06-09 16:28:11,2018-05-23 16:19:11
168,4894,Credit Union Researchers,People researching and comparing credit unions for their financial needs.,2016-08-11 12:08:56,2017-12-27 12:31:08
169,4895,Mature Parents,Parents who had children later in life.,2016-08-11 12:12:27,2018-05-23 11:30:12
170,4896,Streaming Music Enthusiasts,People visiting sites that offer digital music streaming.,2016-08-11 12:12:43,2018-05-23 16:19:11
171,4897,Parents of Teenagers Going to College,People researching and comparing academic programs and college admission applications with their teenagers.,2016-08-11 12:12:51,2017-12-27 12:31:08
172,4898,Cosmetics and Beauty Shoppers,Consumers comparing and shopping for cosmetics and beauty products.,2016-08-11 12:12:57,2017-12-27 12:31:08
173,4899,Readers of Japanese Content,People reading news from Japanese media sources.,2016-08-11 12:13:05,2018-05-23 16:19:11
174,4902,Yogis,Active fans of yoga.,2016-09-07 16:12:46,2018-05-23 11:30:13
175,4903,Asthma Sufferers,People researching asthma trends and treatment options.,2016-09-07 16:12:46,2018-05-23 11:30:12
176,4904,Adult Acne Sufferers,People researching acne trends and treatment options.,2016-09-07 16:12:46,2018-05-23 11:30:12
177,4905,Heartburn Sufferers,People researching heartburn trends and treatment options.,2016-09-07 16:12:46,2018-05-23 11:30:12
178,4906,Sinus Researchers,People researching sinus condition trends and treatment options.,2016-09-07 16:12:46,2018-05-23 11:30:13
179,4907,Headache and Migraine Sufferers,People researching headache and migraine treatment options.,2016-09-07 16:12:46,2018-05-23 11:30:12
180,4908,Back Pain Sufferers,People researching back pain trends and treatment options.,2016-09-07 16:12:46,2018-05-23 11:30:12
181,4909,First Aid Researchers,People researching products and services related to first aid.,2016-09-07 16:12:46,2018-05-23 11:30:12
182,4910,Cholesterol Researchers,People researching cholesterol trends and treatment options.,2016-09-07 16:12:46,2018-05-23 11:30:12
183,4911,Dieters,Consumers reading content about diet and weight loss.,2016-09-07 16:12:46,2018-05-23 11:30:12
184,4912,Vitamin Shoppers,Consumers in-market for vitamins.,2016-09-07 16:12:46,2018-05-23 11:30:13
185,4913,Womens Health Researchers,People researching womens health options.,2016-09-07 16:12:46,2018-05-23 11:30:13
186,4914,Mens Health Researchers,People researching mens health options.,2016-09-07 16:12:46,2018-05-23 11:30:13
187,4915,Food Allergies Researchers,People researching food allergy treatment and alternative food options.,2016-09-07 16:12:46,2018-05-23 11:30:12
188,4916,Arthritis Sufferers,People researching arthritis trends and treatment options.,2016-09-07 16:12:46,2018-05-23 11:30:12
189,4917,Teen Content Readers,People reading sites featuring fashions for teens.,2016-09-07 16:12:46,2018-05-23 11:30:13
190,4918,Gastrointestinal Researchers,People researching gastrointestinal trends and treatment options.,2016-09-07 16:12:46,2018-05-23 11:30:12
191,4919,Military Families,People reading military publications.,2016-09-07 16:12:46,2018-05-23 11:30:13
192,4920,LGBT Activists,People visiting sites advocating LGBT rights.,2016-09-07 16:12:46,2018-05-23 11:30:12
193,4921,Tire Shoppers,Consumers in-market for vehicle tires.,2016-09-07 16:12:46,2018-05-23 11:30:13
194,4924,Surfers,"People reading about surfing sites, techniques and equipment.",2016-09-07 16:12:46,2019-01-16 09:11:30
195,4925,Gun Control Advocates,People visiting sites advocating gun control.,2016-09-07 16:12:46,2018-05-23 11:30:12
196,4926,Gun Rights Advocates,People visiting sites advocating gun rights.,2016-09-07 16:12:46,2018-05-23 11:30:12
197,4927,Immigration Rights Advocates,People visiting sites advocating immigration rights.,2016-09-07 16:12:46,2018-05-23 11:30:12
198,4928,Immigration Control Advocates,People visiting sites advocating immigration control.,2016-09-07 16:12:46,2018-05-23 11:30:12
199,4929,Right Wing Radicals,The Oathkeepers movement.,2016-09-07 16:12:46,2018-05-23 11:30:13
200,4930,Occupy Movement Supporters,People who are interested in the Occupy movement.,2016-09-07 16:12:46,2018-05-23 11:30:13
201,4931,Marijuana Legalization Advocates,People visiting sites advocating the legalization of marijuana.,2016-09-07 16:12:46,2018-05-23 11:30:12
202,4932,Marijuana Prohibition Advocates,People visiting sites advocating the prohibition of marijuana.,2016-09-07 16:12:46,2018-05-23 11:30:12
203,4933,Family Values Advocates,People visiting sites advocating traditional family values.,2016-09-07 16:12:46,2018-05-23 11:30:12
204,4935,Conservative Think Tank Readers,People reading content online related to conservative think tanks.,2016-09-07 16:12:46,2018-05-23 11:30:12
205,4936,Liberal Think Tank Readers,People visiting sites related to liberal think tanks.,2016-09-07 16:12:46,2018-05-23 11:30:12
206,4937,Evangelical Christians,People engaged in Christian online forums.,2016-09-07 16:12:46,2018-05-23 11:30:12
207,4940,Auto-Looking for New Car Purchase or Lease,,2016-10-18 11:50:13,2018-09-07 08:06:38
208,4943,Online Grocery Shoppers,Consumers purchasing groceries online.,2016-10-28 17:25:22,2018-05-23 11:30:13
209,4944,Pre-Measured Grocery Shoppers,Consumers purchasing groceries through a meal delivery service.,2016-10-28 17:25:22,2018-05-23 11:30:13
210,5895,Cardio Health Researchers,People reading news and advice on preventing and treating cardio health issues.,2017-01-05 17:02:35,2017-12-27 12:31:08
211,5896,Orthopedic Health Researchers,People reading news and advice on preventing and treating orthopedic health issues.,2017-01-05 17:02:35,2017-12-27 12:31:08
212,5897,Orthodontics Researchers,People researching and comparing orthodontic practices and treatments.,2017-01-05 17:02:35,2017-12-27 12:31:08
